{
  "schema_version": "1.1.0",
  "record_type": "intent",
  "action_id": "R4-GRA-DF003-PROPOSE",
  "request_sha256": "e770330a75ec20f28854e0caa9cea945ebf2248d93494bb4d210c53035f04a25",
  "execution_context": {
    "run_id": "RUN-R4-GRAFANA-133083",
    "actor": "codex-agent",
    "provider": "openai"
  },
  "action": {
    "action_id": "R4-GRA-DF003-PROPOSE",
    "action_type": "propose_feedback_design_artifacts",
    "stage_id": "design_feedback_application",
    "feedback_id": "DF-003",
    "arguments": {
      "artifacts": {
        "acceptance/testability_gate.json": {
          "project_code": "OSS-BLIND-R4",
          "work_item_id": "GRAFANA-133083",
          "items": [
            {
              "gate_id": "TG-001",
              "source_rule_id": "GRA-R001",
              "source_text": "配置显式 Serializer 后，写入、单条读取、列表和 watch 均优先使用该 Serializer。",
              "classification": "backend_job",
              "testability": "testable",
              "decision": "generate_acceptance_example",
              "reason": "四条操作路径均可注入可观测 Serializer 并分别核对调用。",
              "confidence": "confirmed"
            },
            {
              "gate_id": "TG-002",
              "source_rule_id": "GRA-R002",
              "source_text": "未配置显式 Serializer 时，声明 GVK 的写入继续使用直接 JSON，其他 GVK 的写入使用已配置 codec。",
              "classification": "backend_job",
              "testability": "testable",
              "decision": "generate_acceptance_example",
              "reason": "可构造声明与非声明 GVK，分别检查持久化结果和 codec 调用。",
              "confidence": "confirmed"
            },
            {
              "gate_id": "TG-003",
              "source_rule_id": "GRA-R003",
              "source_text": "未配置显式 Serializer 时，单条读取、列表和 watch 继续使用已配置 codec。",
              "classification": "backend_job",
              "testability": "testable",
              "decision": "generate_acceptance_example",
              "reason": "三条读取路径均可独立触发并观察配置 codec 的解码结果。",
              "confidence": "confirmed"
            },
            {
              "gate_id": "TG-004",
              "source_rule_id": "GRA-R004",
              "source_text": "datasource 通用 JSON Serializer 往返处理后必须保留对象 GVK。",
              "classification": "backend_job",
              "testability": "testable",
              "decision": "generate_acceptance_example",
              "reason": "可对比序列化前后的 GVK，结果确定且可自动断言。",
              "confidence": "confirmed"
            },
            {
              "gate_id": "TG-005",
              "source_rule_id": "GRA-R005",
              "source_text": "同一个 Go 类型承载不同 GVK 时，持久化和读回后仍能区分目标 GVK。",
              "classification": "backend_job",
              "testability": "testable",
              "decision": "generate_acceptance_example",
              "reason": "可用同类型不同 GVK 的对象执行往返并核对各自身份。",
              "confidence": "confirmed"
            },
            {
              "gate_id": "TG-006",
              "source_rule_id": "GRA-R006",
              "source_text": "watch 中当前对象和历史对象的解码沿用原请求 context，并能观察请求取消。",
              "classification": "backend_job",
              "testability": "testable",
              "decision": "generate_acceptance_example",
              "reason": "可分别捕获当前/历史对象的 context，并通过取消请求观察处理终止。",
              "confidence": "confirmed"
            },
            {
              "gate_id": "TG-007",
              "source_rule_id": "RISK-001",
              "source_text": "默认分支若发生变化，可能破坏既有资源的存储格式兼容性。",
              "classification": "risk_hardening",
              "testability": "risk_only",
              "decision": "risk_note_only",
              "reason": "默认兼容已由 GRA-R002/GRA-R003 承接，本项仅保留回归风险。",
              "confidence": "confirmed"
            },
            {
              "gate_id": "TG-008",
              "source_rule_id": "RISK-002",
              "source_text": "列表或 watch 中混合版本/GVK 的对象可能暴露选择不一致。",
              "classification": "risk_hardening",
              "testability": "risk_only",
              "decision": "risk_note_only",
              "reason": "公开需求未定义混合版本组合的完整契约，保留为扩展风险。",
              "confidence": "confirmed"
            },
            {
              "gate_id": "TG-009",
              "source_rule_id": "RISK-003",
              "source_text": "错误的上下文传播可能导致取消失效、资源泄漏或请求结束后继续解码。",
              "classification": "risk_hardening",
              "testability": "risk_only",
              "decision": "risk_note_only",
              "reason": "取消的正式行为由 GRA-R006 承接，资源泄漏属于非功能风险。",
              "confidence": "confirmed"
            },
            {
              "gate_id": "TG-010",
              "source_rule_id": "RISK-004",
              "source_text": "显式 Serializer 与 codec 的职责边界不清时可能出现双重转换。",
              "classification": "risk_hardening",
              "testability": "risk_only",
              "decision": "risk_note_only",
              "reason": "选择优先级已有正式规则，未定义的双重转换实现风险不升级为需求断言。",
              "confidence": "confirmed"
            },
            {
              "gate_id": "TG-011",
              "source_rule_id": "ORACLE-GRA-DF-001",
              "source_text": "Serializer encode/decode 错误、非法 JSON、不可编码值和不同 decode target 属于实现级异常风险。",
              "classification": "risk_hardening",
              "testability": "risk_only",
              "decision": "risk_note_only",
              "reason": "公开需求没有定义这些异常契约，仅保留为代码映证和专项测试风险，不生成正式业务用例。",
              "confidence": "confirmed"
            },
            {
              "gate_id": "TG-012",
              "source_rule_id": "ER-002",
              "source_text": "APIStore 提供可选的、接收请求上下文的 Serializer 能力。",
              "classification": "backend_job",
              "testability": "testable",
              "decision": "generate_acceptance_example",
              "reason": "该语义来自已批准需求摘要，可在写入、单条读取和列表路径注入带标记 context 并核对 Serializer 收到原值。",
              "confidence": "confirmed"
            },
            {
              "gate_id": "TG-013",
              "source_rule_id": "ORACLE-GRA-DF-003",
              "source_text": "Serializer 实际持久化版本、跨资源组输出和删除路径版本豁免属于待确认的实现策略。",
              "classification": "risk_hardening",
              "testability": "risk_only",
              "decision": "risk_note_only",
              "reason": "获批需求未定义版本上限及转换失败规则，只保留实现级风险，不生成正式业务用例。",
              "confidence": "confirmed"
            }
          ]
        }
      }
    },
    "expected_outcome": "将 Grafana DF-003 作为 risk_note_only 写入 Testability Gate"
  },
  "recorded_at": "2026-09-22T04:41:34.983526+00:00"
}
