{
  "schema_version": "1.1.0",
  "record_type": "result",
  "action_id": "R4-GRA-DF001-PROPOSE",
  "request_sha256": "397cf1922fc39ebf7097a6d67d450a403a6c3870b594fa805e1057fbaf6511e7",
  "execution_context": {
    "run_id": "RUN-R4-GRAFANA-133083",
    "actor": "codex-agent",
    "provider": "openai"
  },
  "observation": {
    "ok": true,
    "action_type": "propose_feedback_design_artifacts",
    "result": {
      "status": "proposed",
      "target_layer": "testability_gate",
      "paths": [
        "acceptance/testability_gate.json"
      ]
    }
  },
  "recorded_at": "2026-09-22T04:37:24.651263+00:00"
}
