{
  "schema_version": "1.1.0",
  "record_type": "result",
  "action_id": "R4-K8S-DF001-PROPOSE",
  "request_sha256": "110b7340a18d8866b9859db3fbc33614dc07d963f78eedcae6675d3911bba6cc",
  "execution_context": {
    "run_id": "RUN-R4-KUBERNETES-141831",
    "actor": "codex-agent",
    "provider": "openai"
  },
  "observation": {
    "ok": true,
    "action_type": "propose_feedback_design_artifacts",
    "result": {
      "status": "proposed",
      "target_layer": "testability_gate",
      "paths": [
        "acceptance/testability_gate.json",
        "acceptance/testability_gate.md"
      ]
    }
  },
  "recorded_at": "2026-09-22T04:46:21.782397+00:00"
}
