{
  "schema_version": "1.1.0",
  "record_type": "result",
  "action_id": "R4-GRA-DF003-RECORD",
  "request_sha256": "0a4a7656f519e522cccca92d387e3cb947038288836a3d4bfa05fa51ef139773",
  "execution_context": {
    "run_id": "RUN-R4-GRAFANA-133083",
    "actor": "codex-agent",
    "provider": "openai"
  },
  "observation": {
    "ok": true,
    "action_type": "record_feedback_application",
    "result": {
      "status": "applied",
      "receipt_path": "design/feedback_application.json"
    }
  },
  "recorded_at": "2026-09-22T04:41:35.053046+00:00"
}
